{
  "schema_version": "1.0",
  "run_id": "2026-06-18-daily-discovery",
  "run_date": "2026-06-18",
  "created_at": "2026-06-19T02:03:31.747Z",
  "rule": "Discovery inputs only. Do not cite these sources as factual evidence in public articles.",
  "owner": "Sell In Public editorial",
  "sources": [
    {
      "source_id": "ai-citation-log-2026-06-18",
      "source_type": "manual_ai_prompt_export",
      "name": "Manual AI citation observations",
      "captured_by": "scripts/seo-aeo/build-discovery-run.mjs",
      "captured_at": "2026-06-19T02:03:31.750Z",
      "surface": "manual_ai_citation_log",
      "country": "US",
      "language": "en",
      "path": "analytics/ai_citation_log.csv",
      "allowed_public_use": "none",
      "collection_method": "manual_capture",
      "sanitization_status": "sanitized",
      "license_or_terms_note": "Manual observations are discovery only and not factual evidence.",
      "notes": "Use to identify AEO answer gaps and citation opportunities only.",
      "evidence_use": "discovery_only"
    },
    {
      "source_id": "manual-topic-seed-2026-06-18-daily-plan-topic-seeds-2026-06-18",
      "source_type": "manual_topic_seed",
      "name": "Manual topic seed: 2026-06-18-daily-plan-topic-seeds.csv",
      "captured_by": "Sell In Public editorial",
      "captured_at": "2026-06-19T02:03:31.751Z",
      "surface": "manual_topic_seed",
      "country": "US",
      "language": "en",
      "path": "research/trend-intelligence/2026-06-18-daily-discovery/raw/topic-seed-2026-06-18-daily-plan-topic-seeds.csv",
      "allowed_public_use": "topic_direction",
      "collection_method": "manual_capture",
      "sanitization_status": "sanitized",
      "license_or_terms_note": "Internal editorial topic seed. Use only for discovery and routing.",
      "notes": "Seeds can route topic authority and source-gap work, but cannot validate demand alone.",
      "evidence_use": "discovery_only"
    },
    {
      "source_id": "google_trends_csv_export-2026-06-18-google-trends-topic-turn-employee-expertise-into-posts-2026-06-18",
      "source_type": "google_trends_csv_export",
      "name": "Google Trends CSV export: 2026-06-18-google-trends-topic-turn-employee-expertise-into-posts.csv",
      "captured_by": "Sell In Public editorial",
      "captured_at": "2026-06-19T02:03:31.755Z",
      "surface": "google_trends",
      "country": "US",
      "language": "en",
      "path": "research/trend-intelligence/2026-06-18-daily-discovery/raw/query-export-2026-06-18-google-trends-topic-turn-employee-expertise-into-posts.csv",
      "allowed_public_use": "topic_direction",
      "collection_method": "manual_export",
      "sanitization_status": "not_applicable",
      "license_or_terms_note": "Export captured under the tool's applicable terms. Use for discovery only.",
      "notes": "Manual query exports guide topics, sections, and source gaps only.",
      "evidence_use": "discovery_only"
    },
    {
      "source_id": "google-trends-2026-06-18-google-trends-topic-turn-employee-expertise-into-posts-2026-06-18",
      "source_type": "google_trends_csv_export",
      "name": "Google Trends or trend CSV export: 2026-06-18-google-trends-topic-turn-employee-expertise-into-posts.csv",
      "captured_by": "Sell In Public editorial",
      "captured_at": "2026-06-19T02:03:31.757Z",
      "surface": "google_trends_or_trend_csv",
      "country": "US",
      "language": "en",
      "path": "research/trend-intelligence/2026-06-18-daily-discovery/raw/trend-export-2026-06-18-google-trends-topic-turn-employee-expertise-into-posts.csv",
      "allowed_public_use": "topic_direction",
      "collection_method": "manual_export",
      "sanitization_status": "not_applicable",
      "license_or_terms_note": "Trend values are relative interest only, not factual demand volume.",
      "notes": "Use trend movement for prioritization only.",
      "evidence_use": "discovery_only"
    },
    {
      "source_id": "public-trends-google-search-central-20260618",
      "source_type": "public_source_trend_export",
      "name": "Google Search Central Blog",
      "captured_by": "Sell In Public editorial",
      "captured_at": "2026-06-19T02:03:31.761Z",
      "surface": "official_search_blog",
      "country": "US",
      "language": "en",
      "path": "research/trend-intelligence/2026-06-18-daily-discovery/raw/trend-export-2026-06-18-public-trends.csv",
      "allowed_public_use": "topic_direction",
      "collection_method": "public_feed_capture",
      "sanitization_status": "not_applicable",
      "license_or_terms_note": "Public headline/feed metadata is discovery only and must not be cited as factual evidence without source verification.",
      "notes": "Official Google Search Central feed. Discovery only; verify facts against the canonical post before citing.",
      "evidence_use": "discovery_only"
    },
    {
      "source_id": "public-trends-ahrefs-blog-20260618",
      "source_type": "public_source_trend_export",
      "name": "Ahrefs Blog",
      "captured_by": "Sell In Public editorial",
      "captured_at": "2026-06-19T02:03:31.761Z",
      "surface": "seo_research_blog",
      "country": "US",
      "language": "en",
      "path": "research/trend-intelligence/2026-06-18-daily-discovery/raw/trend-export-2026-06-18-public-trends.csv",
      "allowed_public_use": "topic_direction",
      "collection_method": "public_feed_capture",
      "sanitization_status": "not_applicable",
      "license_or_terms_note": "Public headline/feed metadata is discovery only and must not be cited as factual evidence without source verification.",
      "notes": "Ahrefs SEO and AI-search feed. Discovery only; use primary research pages as evidence only after Source Registry review.",
      "evidence_use": "discovery_only"
    },
    {
      "source_id": "public-trends-semrush-blog-20260618",
      "source_type": "public_source_trend_export",
      "name": "Semrush Blog",
      "captured_by": "Sell In Public editorial",
      "captured_at": "2026-06-19T02:03:31.761Z",
      "surface": "seo_ai_search_blog",
      "country": "US",
      "language": "en",
      "path": "research/trend-intelligence/2026-06-18-daily-discovery/raw/trend-export-2026-06-18-public-trends.csv",
      "allowed_public_use": "topic_direction",
      "collection_method": "public_feed_capture",
      "sanitization_status": "not_applicable",
      "license_or_terms_note": "Public headline/feed metadata is discovery only and must not be cited as factual evidence without source verification.",
      "notes": "Semrush SEO and AI-search feed. Discovery only; validate any claim against the canonical post and accepted source policy.",
      "evidence_use": "discovery_only"
    },
    {
      "source_id": "public-trends-hubspot-marketing-blog-20260618",
      "source_type": "public_source_trend_export",
      "name": "HubSpot Marketing Blog",
      "captured_by": "Sell In Public editorial",
      "captured_at": "2026-06-19T02:03:31.761Z",
      "surface": "marketing_blog",
      "country": "US",
      "language": "en",
      "path": "research/trend-intelligence/2026-06-18-daily-discovery/raw/trend-export-2026-06-18-public-trends.csv",
      "allowed_public_use": "topic_direction",
      "collection_method": "public_feed_capture",
      "sanitization_status": "not_applicable",
      "license_or_terms_note": "Public headline/feed metadata is discovery only and must not be cited as factual evidence without source verification.",
      "notes": "HubSpot marketing feed. Discovery only; use for topic/source leads, not factual evidence by default.",
      "evidence_use": "discovery_only"
    },
    {
      "source_id": "public-trends-hubspot-sales-blog-20260618",
      "source_type": "public_source_trend_export",
      "name": "HubSpot Sales Blog",
      "captured_by": "Sell In Public editorial",
      "captured_at": "2026-06-19T02:03:31.761Z",
      "surface": "sales_blog",
      "country": "US",
      "language": "en",
      "path": "research/trend-intelligence/2026-06-18-daily-discovery/raw/trend-export-2026-06-18-public-trends.csv",
      "allowed_public_use": "topic_direction",
      "collection_method": "public_feed_capture",
      "sanitization_status": "not_applicable",
      "license_or_terms_note": "Public headline/feed metadata is discovery only and must not be cited as factual evidence without source verification.",
      "notes": "HubSpot sales feed. Discovery only; use for GTM language and source-discovery leads.",
      "evidence_use": "discovery_only"
    },
    {
      "source_id": "public-trends-linkedin-marketing-blog-20260618",
      "source_type": "public_source_trend_export",
      "name": "LinkedIn Marketing Blog",
      "captured_by": "Sell In Public editorial",
      "captured_at": "2026-06-19T02:03:31.761Z",
      "surface": "linkedin_marketing_blog",
      "country": "US",
      "language": "en",
      "path": "research/trend-intelligence/2026-06-18-daily-discovery/raw/trend-export-2026-06-18-public-trends.csv",
      "allowed_public_use": "topic_direction",
      "collection_method": "public_feed_capture",
      "sanitization_status": "not_applicable",
      "license_or_terms_note": "Public headline/feed metadata is discovery only and must not be cited as factual evidence without source verification.",
      "notes": "LinkedIn Marketing public RSS feed. Discovery only; validate against canonical source pages before citing.",
      "evidence_use": "discovery_only"
    }
  ]
}
